{"allowed_removal_operations":["remove-file"],"artifacts":[{"path":"bundle.json","role":"candidate-runtime-bundle","sha256":"f1134e8dde7de0dcb4745d5949ff6b0b51c0f512bac2e3e1d3a774687dcb73b1"},{"path":"derived-portrayal.json","role":"derived-portrayal","sha256":"8302a7b937401da05ffb323b312932ae4dabe64ca73162c501967475ab8732ce"},{"path":"data/road-centreline-source.geojson","role":"selected-native-geometry","sha256":"8baf555b9d4b69bf9e56731fe2233a29822c897f095d0f6257436aa192c89bea"},{"path":"data/road-centreline-runtime.geojson","role":"candidate-runtime-geometry","sha256":"d13096fb82a1e0588898ade94070becec531ebc07e77fe7795a3d92f8d56db08"}],"bundle":{"id":"road-bundle-road-exec-33766f336d9cc18eb2ac159e","sha256":"33aa7c6b0d557fa9a72e2fa4e0106493d8dfe10ec9201bd7762e204bb14a286d"},"execution_id":"road-exec-33766f336d9cc18eb2ac159e","preserve_paths":["authorization.json","plan.json","receipt.json","rollback-manifest.json","consumption.json","observations"],"receipt":{"id":"road-receipt-road-exec-33766f336d9cc18eb2ac159e","sha256":"0ab5964fcc2e1f47d43fd328dbc3771a7e624bf4a3707f91236a1485f5610720"},"rollback_manifest_id":"road-rollback-road-exec-33766f336d9cc18eb2ac159e","rollback_manifest_sha256":"03bc4f84d27b9b55baa7403d4ff4abc758ff223d0ffe7b7aaaa11233da162ae2","rollback_root":".","runtime_ids":{"layer_ids":["nma-road-label-road-exec-33766f336d9cc18eb2ac159e"],"source_ids":["nma-road-source-road-exec-33766f336d9cc18eb2ac159e"]},"schema":"nma.road-rollback-manifest/1.0","status":"ready"}
